{
	"items": [
		{
			"ValueId": 311039,
			"IndependentValue": null,
			"IndependentValueNumber": null,
			"IndependentValueDate": null,
			"IndependentValueTimestamp": null,
			"Value": "J14100",
			"ValueNumber": null,
			"ValueDate": null,
			"ValueTimestamp": null,
			"TranslatedValue": null,
			"Description": "Abi Group [49770]",
			"EnabledFlag": "Y",
			"StartDateActive": null,
			"EndDateActive": null,
			"SortOrder": null,
			"SummaryFlag": "N",
			"DetailPostingAllowed": "Y",
			"DetailBudgetingAllowed": "Y",
			"AccountType": null,
			"ControlAccount": null,
			"ReconciliationFlag": null,
			"FinancialCategory": null,
			"ExternalDataSource": null,
			"CreationDate": "2021-04-06T07:58:44+00:00",
			"CreatedBy": "SIS_INTEGRATION",
			"LastUpdateDate": "2021-04-06T07:58:44.106+00:00",
			"LastUpdatedBy": "SIS_INTEGRATION",
			"links": [
				{
					"rel": "self",
					"href": "https://fa-epnz-test-saasfaprod1.fa.ocs.oraclecloud.com:443/fscmRestApi/resources/11.13.18.05/valueSets/Customer%20Site%20SIS_COA/child/values/311039",
					"name": "values",
					"kind": "item"
				},
				{
					"rel": "canonical",
					"href": "https://fa-epnz-test-saasfaprod1.fa.ocs.oraclecloud.com:443/fscmRestApi/resources/11.13.18.05/valueSets/Customer%20Site%20SIS_COA/child/values/311039",
					"name": "values",
					"kind": "item"
				},
				{
					"rel": "parent",
					"href": "https://fa-epnz-test-saasfaprod1.fa.ocs.oraclecloud.com:443/fscmRestApi/resources/11.13.18.05/valueSets/Customer%20Site%20SIS_COA",
					"name": "valueSets",
					"kind": "item"
				},
				{
					"rel": "child",
					"href": "https://fa-epnz-test-saasfaprod1.fa.ocs.oraclecloud.com:443/fscmRestApi/resources/11.13.18.05/valueSets/Customer%20Site%20SIS_COA/child/values/311039/child/valuesDFF",
					"name": "valuesDFF",
					"kind": "collection"
				}
			]
		}
	],
	"count": 1,
	"hasMore": false,
	"limit": 25,
	"offset": 0,
	"links": [
		{
			"rel": "self",
			"href": "https://fa-epnz-test-saasfaprod1.fa.ocs.oraclecloud.com:443/fscmRestApi/resources/11.13.18.05/valueSets/Customer%20Site%20SIS_COA/child/values",
			"name": "values",
			"kind": "collection"
		}
	]
}